{
  "$schema": "https://json-schema.org/draft/2020-12/schema",
  "title": "Exemple d’analyse de recherche RSI — pas un ordre",
  "type": "object",
  "additionalProperties": false,
  "required": [
    "schema_version",
    "mode",
    "synthetic",
    "as_of",
    "instrument",
    "timeframe",
    "data_quality",
    "rsi",
    "regime",
    "divergences",
    "decision",
    "source_ids"
  ],
  "properties": {
    "schema_version": {
      "const": "1.0.0"
    },
    "mode": {
      "const": "research_only"
    },
    "synthetic": {
      "type": "boolean"
    },
    "as_of": {
      "type": "string",
      "format": "date-time"
    },
    "instrument": {
      "type": "string",
      "minLength": 1
    },
    "timeframe": {
      "type": "string",
      "minLength": 1
    },
    "data_quality": {
      "type": "object",
      "additionalProperties": false,
      "required": [
        "status",
        "last_closed_bar_end",
        "missing_fields"
      ],
      "properties": {
        "status": {
          "enum": [
            "valid",
            "degraded",
            "stale",
            "unknown"
          ]
        },
        "last_closed_bar_end": {
          "type": [
            "string",
            "null"
          ],
          "format": "date-time"
        },
        "missing_fields": {
          "type": "array",
          "items": {
            "type": "string"
          }
        }
      }
    },
    "rsi": {
      "type": "object",
      "additionalProperties": false,
      "required": [
        "value",
        "period",
        "smoothing",
        "price_source",
        "confirmed",
        "zone"
      ],
      "properties": {
        "value": {
          "type": [
            "number",
            "null"
          ],
          "minimum": 0,
          "maximum": 100
        },
        "period": {
          "type": "integer",
          "minimum": 1
        },
        "smoothing": {
          "const": "wilder"
        },
        "price_source": {
          "const": "close"
        },
        "confirmed": {
          "type": "boolean"
        },
        "zone": {
          "enum": [
            "oversold",
            "middle",
            "overbought",
            "unavailable"
          ]
        }
      }
    },
    "regime": {
      "type": "object",
      "additionalProperties": false,
      "required": [
        "direction",
        "method",
        "volatility_state"
      ],
      "properties": {
        "direction": {
          "enum": [
            "uptrend",
            "downtrend",
            "range",
            "transition",
            "unknown"
          ]
        },
        "method": {
          "type": "string"
        },
        "volatility_state": {
          "enum": [
            "low",
            "normal",
            "high",
            "unknown"
          ]
        }
      }
    },
    "divergences": {
      "type": "array",
      "items": {
        "type": "object",
        "additionalProperties": false,
        "required": [
          "type",
          "pivot_1_time",
          "pivot_2_time",
          "confirmed_at",
          "alignment_method"
        ],
        "properties": {
          "type": {
            "enum": [
              "regular_bullish",
              "regular_bearish",
              "hidden_bullish",
              "hidden_bearish",
              "equal_extremes"
            ]
          },
          "pivot_1_time": {
            "type": "string",
            "format": "date-time"
          },
          "pivot_2_time": {
            "type": "string",
            "format": "date-time"
          },
          "confirmed_at": {
            "type": "string",
            "format": "date-time"
          },
          "alignment_method": {
            "enum": [
              "price_pivot_anchored",
              "paired_confirmed_pivots"
            ]
          }
        }
      }
    },
    "decision": {
      "type": "object",
      "additionalProperties": false,
      "required": [
        "action",
        "reason_codes",
        "calibrated_success_probability",
        "live_enabled"
      ],
      "properties": {
        "action": {
          "enum": [
            "WAIT",
            "REJECT",
            "RESEARCH_CANDIDATE"
          ]
        },
        "reason_codes": {
          "type": "array",
          "minItems": 1,
          "items": {
            "type": "string"
          }
        },
        "calibrated_success_probability": {
          "type": "null"
        },
        "live_enabled": {
          "const": false
        }
      }
    },
    "source_ids": {
      "type": "array",
      "items": {
        "enum": [
          "S01",
          "S02",
          "S03",
          "S04",
          "S05",
          "S06",
          "S07",
          "S08",
          "S09",
          "S10",
          "S11",
          "S12",
          "S13",
          "S14",
          "S15",
          "S16",
          "S17",
          "S18",
          "S19",
          "S20",
          "S21",
          "S22",
          "S23",
          "S24",
          "S25",
          "S26",
          "S27",
          "S28",
          "S29",
          "S30"
        ]
      },
      "uniqueItems": true
    }
  },
  "description": "Structure documentaire proposée. Validation métier additionnelle obligatoire : dates croissantes, confirmed_at<=as_of, cohérence valeur/zone, barres confirmées, appariement causal. Ce schéma ne décrit aucune passerelle d’ordres."
}
